{
  "definitions": {},
  "$schema": "http://json-schema.org/draft-07/schema#",
  "type": "object",
  "required": [
    "id",
    "internal_name",
    "path",
    "capabilities",
    "description"
  ],
  "additionalProperties": false,
  "properties": {
    "$schema": {
      "type": "string"
    },
    "id": {
      "type": "integer"
    },
    "internal_name": {
      "type": "string"
    },
    "path": {
      "type": "null"
    },
    "capabilities": {
      "type": "object",
      "additionalProperties": false,
      "required": [
        "interest",
        "inflation",
        "outputgap",
        "output",
        "mp_shock",
        "fiscal_shock",
        "rules"
      ],
      "properties": {
        "interest": {
          "type": "boolean"
        },
        "inflation": {
          "type": "boolean"
        },
        "outputgap": {
          "type": "boolean"
        },
        "output": {
          "type": "boolean"
        },
        "mp_shock": {
          "type": "boolean"
        },
        "fiscal_shock": {
          "type": "boolean"
        },
        "rules":{
          "type": "array",
          "items": {
            "type": "number"
          }
        }
      }
    },
    "msr": {
      "type": "array",
      "items": {
        "type": "string"
      },
      "minItems": 33,
      "maxItems": 33
    },
    "description": {
      "type": "object",
      "required": [
        "ac_ref",
        "paper_title",
        "journal",
        "replicants_name",
        "pub_date",
        "keywords",
        "description",
        "category",
        "authors"
      ],
      "properties": {
        "ac_ref": {
          "type": "string"
        },
        "paper_title": {
          "type": "string"
        },
        "journal": {
          "type": [
            "string",
            "null"
          ]
        },
        "replicants_name": {
          "type": [
            "string",
            "null"
          ]
        },
        "pub_date": {
          "type": "string"
        },
        "keywords": {
          "type": "array"
        },
        "description": {
          "type": "string"
        },
        "category": {
          "type": "string"
        },
        "authors": {
          "type": "array",
          "items": {
            "type": "string"
          }
        }
      }
    }
  }
}
